{
  "report_id": "rpt_d0bfe51864f4",
  "video_id": "normal_01",
  "mode": "fast",
  "frame_index": 0,
  "report_timestamp": "2026-07-09T14:26:47.129466+00:00",
  "system_version": "0.1.0",
  "overall_mos": 3.7,
  "severity": "critical",
  "degradations": [
    {
      "degradation_id": "deg_3e056c39",
      "region_type": "edge",
      "degradation_type": "green_spill",
      "severity": "critical",
      "confidence": 0.55,
      "mos_impact": -0.8,
      "bbox": [
        41,
        14,
        190,
        177
      ],
      "frame_indices": [
        0
      ],
      "description": "人物轮廓边缘出现绿色溢色/抠像绿边",
      "detector": "edge_bleed",
      "evidence": {
        "method": "green_spill_lab_delta_e",
        "metric": "spill_ratio",
        "value": 0.0,
        "threshold": 0.05,
        "detail": "边缘带绿色溢出比例 0.0%，Lab ΔE 均值 43.9；超过阈值 spill≥5% / ΔE≥10.0",
        "attention_map": null
      },
      "root_cause_hypothesis": {
        "cause": "matting_error",
        "confidence": 0.5
      },
      "vlm_reasoning": null
    }
  ],
  "decision_trace": [
    {
      "stage": "mode_select",
      "module": "FastPipeline",
      "timestamp_ms": 0.0,
      "duration_ms": 0.0,
      "input_summary": {
        "requested_mode": "fast"
      },
      "output_summary": {
        "selected_mode": "fast"
      },
      "decision": "mode_fast",
      "mode": "fast"
    },
    {
      "stage": "global_scan",
      "module": "GlobalScanner",
      "timestamp_ms": 0.0,
      "duration_ms": 28.452291997382417,
      "input_summary": {
        "frame_id": "normal_01",
        "shape": [
          240,
          320,
          3
        ]
      },
      "output_summary": {
        "nominations": 2,
        "global_quality_score": 0.8205194270833334
      },
      "decision": "scan_complete",
      "mode": "fast"
    },
    {
      "stage": "routing",
      "module": "FixedRouter",
      "timestamp_ms": 28.452291997382417,
      "duration_ms": 0.0,
      "input_summary": {
        "nominations": [
          [
            "edge_bleed"
          ],
          [
            "compression_artifact"
          ]
        ]
      },
      "output_summary": {
        "detectors": [
          "edge_bleed",
          "compression_artifact"
        ]
      },
      "decision": "fixed_v01_route",
      "mode": "fast"
    },
    {
      "stage": "detection",
      "module": "FastDetectors",
      "timestamp_ms": 28.452291997382417,
      "duration_ms": 57.708916981937364,
      "input_summary": {
        "detectors": [
          "edge_bleed",
          "compression_artifact"
        ]
      },
      "output_summary": {
        "degradation_count": 1
      },
      "decision": "detectors_complete",
      "mode": "fast"
    },
    {
      "stage": "aggregation",
      "module": "ReportGenerator",
      "timestamp_ms": 86.16120897931978,
      "duration_ms": 0.00016702688299119473,
      "input_summary": {
        "degradation_count": 1
      },
      "output_summary": {
        "severity_pending": true
      },
      "decision": "aggregate_mos",
      "mode": "fast"
    }
  ],
  "performance": {
    "total_ms": 86.1947079829406,
    "global_scan_ms": 28.452291997382417,
    "detection_ms": 57.708916981937364,
    "aggregation_ms": 0.00016702688299119473
  },
  "vlm_reasoning_summary": null,
  "mos_breakdown": {
    "base_mos": 4.5,
    "total_penalty": -0.8,
    "cap_applied": false,
    "cap_reason": null,
    "penalties": [
      {
        "source": "deg_3e056c39",
        "penalty": -0.8,
        "effective_penalty": -0.8,
        "decay_index": 0,
        "reason": "人物轮廓边缘出现绿色溢色/抠像绿边"
      }
    ]
  },
  "degradation_summary": {
    "total_count": 1,
    "by_severity": {
      "critical": 1
    },
    "by_detector": {
      "edge_bleed": 1
    },
    "by_root_cause": {
      "matting_error": 1
    },
    "top_issues": [
      "人物轮廓边缘出现绿色溢色/抠像绿边"
    ]
  }
}